{
  "$schema": "./schemas/collections.schema.json",
  "_reference": "docs/concepts/collections.md",
  "schema_version": "5.0",
  "description": "Curated puzzle collections organized by theme, difficulty, and author. Single source of truth for collection metadata and alias matching.",
  "last_updated": "2026-04-13",
  "changelog": [
    {
      "version": "5.7",
      "date": "2026-04-13",
      "author": "claude",
      "changes": "Tsumego Hero collection mapping: renamed kano-yoshinori-graded-go-problems-beginners-1 to kano-yoshinori-graded-go-problems (ID 85, 4 volumes as chapters), renamed korean-problem-academy-1 to korean-problem-academy (ID 137, 4 volumes as chapters). Added 6 new entries: tsumego-dictionary (188), weiqi-problems (189), kim-jiseok-tsumego (190), yi-kuo (191), small-board-problems (192), capturing-races-unsolved (193)."
    },
    {
      "version": "5.6",
      "date": "2026-04-06",
      "author": "claude",
      "changes": "Kaku Kyushin enrichment: added kaku-kyushin-200-tsumego (ID 186) and kaku-kyushin-fighting-strength (ID 187). 351 puzzles total. Fixed cn-en-dictionary 'diagram' translations."
    },
    {
      "version": "5.5",
      "date": "2026-04-06",
      "author": "claude",
      "changes": "Lee Changho enrichment: updated lee-changho-tesuji (ID 45) description with 735 puzzles across 6 volumes. Corrected file count from 311 to 735."
    },
    {
      "version": "5.4",
      "date": "2026-04-06",
      "author": "claude",
      "changes": "Sakata Eio enrichment: added sakata-eio-tesuji (ID 185). 110 tesuji problems across 9 technique chapters."
    },
    {
      "version": "5.3",
      "date": "2026-04-05",
      "author": "claude",
      "changes": "Sato Sunao enrichment: added 2 new collections (refreshing-tsumego ID 178, flexible-tsumego ID 179). 268 puzzles total."
    },
    {
      "version": "5.2",
      "date": "2026-04-04",
      "author": "claude",
      "changes": "Kada Katsuji enrichment: added 3 new collections (tsumego-brilliances ID 171, tsumego-class ID 172, tsumego-masterpieces ID 173). 700 puzzles total."
    },
    {
      "version": "5.1",
      "date": "2026-04-04",
      "author": "claude",
      "changes": "Maeda Nobuaki enrichment: renamed 5 slugs to maeda-nobuaki-* format (old slugs preserved as aliases), added 4 new collections (advanced-tsumego, delightful-tsumego, tsumego-for-the-millions, newly-selected-100-continued). 9 total Maeda collections."
    },
    {
      "version": "5.0",
      "date": "2026-02-25",
      "author": "unknown",
      "changes": "Added optional level_hint for collection-based level override."
    },
    {
      "version": "4.0",
      "date": "unknown",
      "author": "unknown",
      "changes": "Added numeric IDs for compact schema."
    },
    {
      "version": "3.0",
      "date": "unknown",
      "author": "unknown",
      "changes": "Added tier field."
    },
    {
      "version": "2.0",
      "date": "unknown",
      "author": "unknown",
      "changes": "Added ordering field."
    },
    {
      "version": "1.0",
      "date": "unknown",
      "author": "initial",
      "changes": "Initial collection catalog."
    }
  ],
  "collections": [
    {
      "slug": "advanced-essentials",
      "name": "Advanced Essentials",
      "description": "Curated learning path for advanced kyu players (5k-1k). Deep reading and advanced tesuji application.",
      "curator": "Curated",
      "source": "mixed",
      "type": "graded",
      "ordering": "manual",
      "tier": "editorial",
      "aliases": [
        "2 Dan up",
        "5k-1k",
        "Graded Go Problems for Dan Players — Life & Death",
        "How to Become a Dan",
        "advanced kyu",
        "bgs go 4k-1d"
      ],
      "level_hint": "advanced",
      "id": 1
    },
    {
      "slug": "beginner-essentials",
      "name": "Beginner Essentials",
      "description": "Curated learning path for beginner players (25k-21k). Basic captures and simple life-and-death patterns.",
      "curator": "Curated",
      "source": "mixed",
      "type": "graded",
      "ordering": "manual",
      "tier": "editorial",
      "aliases": [
        "#1Beginner#1",
        "20-25 Kyu problems. (Beginner pack)",
        "20-25 Kyu problems. (Beginner's pack)",
        "25k-21k",
        "Beginner Brain Teasers 30 Kyu",
        "Beginner Go Concepts",
        "Beginner Go: Tutorial Volume 1",
        "Beginner Problems (French)",
        "Beginner course",
        "Beginner stuff",
        "Beginner's Go: Tutorial Volume 1",
        "Beginner's course",
        "Beginner1",
        "Beginner2",
        "Beginners (Spanish)",
        "Board 19 19 for beginners",
        "Board 19х19 for beginners",
        "Clossius Beginner Go Puzzles",
        "Exercises for Beginners",
        "Go problems for beginners 30-25kyu",
        "Intermidiate Puzzles for Beginners 1",
        "Kopfnüsse für Neueinsteiger - DGoZ 4/2022, ab 30 Kyu",
        "Principiantes",
        "Puzzle for beginners",
        "Stone Development for Beginners",
        "The Wisdom of Go Beginners",
        "The best collection for beginners. Vol. 1, 30-20k.",
        "a few beginner examples for a friend",
        "beginner questions",
        "beginner quick learn",
        "beginner tsumego",
        "beginner's questions",
        "beginners question collection",
        "problème pour débutant",
        "week 1 (Beginner)"
      ],
      "level_hint": "beginner",
      "id": 2
    },
    {
      "slug": "capture-problems",
      "name": "Capture Problems",
      "description": "Problems focusing on capturing techniques including basic captures, sacrifice captures, and advanced capture tactics.",
      "curator": "Curated",
      "source": "mixed",
      "type": "technique",
      "ordering": "source",
      "tier": "editorial",
      "aliases": [
        "101Weiqi: Capture by Shunt (Bao Chi), 15-10k",
        "Advanced Capturing",
        "Basic Captures",
        "Beginner Guide to Capturing",
        "Beginner's Guide to Capturing",
        "Black cuts white first2024",
        "Black eats white first2024",
        "Captura",
        "Capture (101 Weiqi)",
        "Capture (Spanish)",
        "Capture Concept",
        "Capture Direction Drills",
        "Capture Drills (Vietnamese)",
        "Capture Exercises 1",
        "Capture Skills for Beginner",
        "Capture by Shunt (Bao Chi), 15-10k",
        "Capture by divide",
        "Capture opportunity on 7",
        "Capture towards own stone",
        "Capture towards the first line",
        "Capture two, recapture one to live",
        "Captures and Eyes Revision",
        "Capturing",
        "Capturing Basics by Krun",
        "Capturing Fundamentals",
        "Capturing Tactics",
        "Cướp trên lớp",
        "EAT TIME!",
        "Easy Capture for Beginner",
        "Easy Capture, Difficulty: 11k",
        "Ejercicios capturas I",
        "Hướng bắt quân trên lớp",
        "Krun Capturing",
        "PIM Capture",
        "PIM How to Capture",
        "Problem - TsumegoHero - Easy Capture",
        "Tsumego Hero Easy Capture",
        "eat me if you can",
        "train your capture skills",
        "Задачи на взятие камней. 2",
        "Задачи на взятие камней. 3",
        "Задачи на взятие камней.1",
        "จับกินเบื้องต้น By Krun",
        "ท่าจับกิน Krun",
        "向一線方向叫吃 Capture towards the first line",
        "向己方方向叫吃 Capture towards own stone",
        "打二還一做活 Capture two, recapture one to live",
        "斷吃 Capture by divide"
      ],
      "id": 3
    },
    {
      "slug": "capturing-race",
      "name": "Capturing Race (Semeai)",
      "description": "Liberty-counting race problems between adjacent groups where both sides fight to capture first.",
      "curator": "Curated",
      "source": "mixed",
      "type": "technique",
      "ordering": "difficulty",
      "tier": "editorial",
      "aliases": [
        "101Weiqi : Capturing Races",
        "Bắt đôi trên lớp",
        "Capture Race Drills",
        "Capture race -Elementary 2",
        "Capturing Races",
        "Capturing race3",
        "Capturing race4",
        "Capturing race5",
        "Capturing race6",
        "Semeai Drills",
        "Tesuji: Semeai",
        "liberty race",
        "semeai",
        "Đối sát trên lớp",
        "Тэсудзи 3 Сэмэай",
        "對殺3 Capturing race3",
        "對殺4 Capturing race4",
        "對殺5 Capturing race5",
        "對殺6 Capturing race6",
        "攻め合い"
      ],
      "id": 4
    },
    {
      "slug": "cho-chikun-life-death-advanced",
      "name": "Cho Chikun Life & Death: Advanced",
      "description": "Advanced volume of Cho Chikun's Encyclopedia of Life and Death. Complex multi-step problems for dan-level study.",
      "curator": "Cho Chikun",
      "source": "kisvadim",
      "type": "author",
      "ordering": "source",
      "tier": "editorial",
      "aliases": [
        "Chikun - All about life and death - Volume 2 - A Basic Dictionary of Life and Death Part 9+",
        "cho advanced",
        "encyclopedia life and death advanced",
        "encyclopedia life death advanced",
        "基本死活事典 上級"
      ],
      "level_hint": "advanced",
      "id": 5
    },
    {
      "slug": "cho-chikun-life-death-elementary",
      "name": "Cho Chikun Life & Death: Elementary",
      "description": "Elementary volume of Cho Chikun's Encyclopedia of Life and Death. The definitive modern reference for basic life-and-death study.",
      "curator": "Cho Chikun",
      "source": "kisvadim",
      "type": "author",
      "ordering": "source",
      "tier": "editorial",
      "aliases": [
        "Cho Chikun \"An Encyclopedia of Life & Death\" - for Beginners",
        "Cho Chikun - Life and Death",
        "Cho Chikun Elementary problems (from 200)",
        "Cho Chikun Problems (Spanish)",
        "Cho Chikun's \"An Encyclopedia of Life & Death\" - for Beginners",